username,timestamp,likes,komentar
armpkoko,11/7/2026, 14.20.30,0,"Orang yg omongannya  tidak bisa dipercaya."
hamster.75963910,11/7/2026, 14.05.39,0,"Alhamdulillah siang”gini di kasih menang 7,2jt di ZOYAMAX 💸🥰"
sheep.6180830,11/7/2026, 14.04.20,0,"Ga nyangka main di #ZOYAMAX bawa modal 100k di naikin 6jt lumayan lah🤤🤤🤤"
jahi.dul1271,11/7/2026, 14.04.17,0,"Yee menang lagi gw barusan 8,5jt main d #ZOYAMAX 💸"
ahirji2080,11/7/2026, 14.04.14,0,"Saya modal 150k di kasih wd 3jt mas di ZOYAMAX 😍🔥"
su362911,11/7/2026, 14.04.14,0,"Main cuma mdal 200 jadi 6jt uh pedass bngt hanya di ZOYAMAX"
batkumar986532,11/7/2026, 14.04.13,0,"Gua juga di kasih menang main di #ZOYAMAX 💸"
m4man_i123,11/7/2026, 14.04.11,0,"Yee menang lagi gw barusan 8,5jt main d #ZOYAMAX 💸"
panda.1141805,11/7/2026, 14.04.11,0,"Alhamdulillah siang”gini di kasih menang 7,2jt di ZOYAMAX 💸🥰"
my_cute_boy_1000,11/7/2026, 14.04.12,0,"Nah ini dia yang bikin gw narik kemaren,emang ngak bisa di ragukan lgi dehhh #ZOYAMAX"
sahin.4286594,11/7/2026, 14.04.12,0,"Mantap link paling amanah #ZOYAMAX"
sheep.6457472,11/7/2026, 14.04.11,0,"Nah ini dia yang bikin gw narik kemaren,emang ngak bisa di ragukan lgi dehhh #ZOYAMAX"
king490835,11/7/2026, 14.04.10,0,"Thank infonya ZOYAMAX, tadi modal 50 jadi 2jt 😁🥰"
arushshinde1515,11/7/2026, 14.04.10,0,"Alhamdulillah Masih Dikasih Menang 7,2jt di ( ZOYAMAX )"
myra.chaudharyedits__449,11/7/2026, 14.04.10,0,"POV : SALDO SISA 300K JDI 20jt🥰maksih ZOYAMAX"
x_ibran_edits.02,11/7/2026, 14.04.10,0,"Mantap link paling amanah #ZOYAMAX"
ix_vishnu_90,11/7/2026, 14.04.10,0,"Thank infonya ZOYAMAX, tadi modal 50 jadi 2jt 😁🥰"
potti9982026,11/7/2026, 14.04.10,0,"Fuul senyum di kasih menang 12,4jt di ZOYAMAX 💵🔥"
kiran69136,11/7/2026, 14.04.10,0,"POV : SALDO SISA 300K JDI 20jt🥰maksih ZOYAMAX"
kejeudushdjd,11/7/2026, 14.04.09,0,"Sumpah kali ini gw percaya Ama lu bg,Barusan gw berhasil narik 7jt hari ini di ZOYAMAX 🫡"
its_mahi__kumari35,11/7/2026, 14.04.10,0,"Alhamdulillah siang”gini di kasih menang 7,2jt di ZOYAMAX 💸🥰"
buro_bole_,11/7/2026, 14.04.09,0,"Gw bawah 200k doang jdi 5,4jt padahal cuma main bentr doang d #ZOYAMAX🥰🥰"
officialchunera01,11/7/2026, 14.04.09,0,"Alhamdulillah WD lagi 5jt di #ZOYAMAX 🩷🤗"
rhino13492,11/7/2026, 14.04.08,0,"Alhamdulillah Masih Dikasih Menang 7,2jt di ( ZOYAMAX )"
miss_neha_yy,11/7/2026, 14.04.08,0,"Sumpah kali ini gw percaya Ama lu bg,Barusan gw berhasil narik 7jt hari ini di ZOYAMAX 🫡"
gecko.2397137,11/7/2026, 14.04.07,0,"POV : SALDO SISA 300K JDI 20jt🥰maksih ZOYAMAX"
shizu.__.07,11/7/2026, 14.04.08,0,"tiga ratus jadi enam juta bosqu🥰 search google ZOYAMAX"
mis__janu___123,11/7/2026, 14.04.07,0,"tiga ratus jadi enam juta bosqu🥰 search google ZOYAMAX"
subh.ankar658,11/7/2026, 14.04.07,0,"Bukan maen jam segini di kasih wd gede 21,5 jt bg ZOYAMAX 🔥💸💵"
chaman66628,11/7/2026, 14.04.08,0,"Puas banget emang main disini emg, dari kemarin gua nyoba dikasih wd teros gokil ZOYAMAX"
abhishekrajput_7774,11/7/2026, 14.04.07,0,"Alhamdulillah Masih Dikasih Menang 7,2jt di ( ZOYAMAX )"
brich5610,11/7/2026, 14.04.07,0,"Fuul senyum di kasih menang 12,4jt di ZOYAMAX 💵🔥"
jellyfish.3353601,11/7/2026, 14.04.07,0,"tiga ratus jadi enam juta bosqu🥰 search google ZOYAMAX"
its_sakshi___143_______,11/7/2026, 14.04.06,0,"Gw bawah 200k doang jdi 5,4jt padahal cuma main bentr doang d #ZOYAMAX🥰🥰"
asmin_a142,11/7/2026, 14.04.06,0,"Alhamdulillah ngeri kali menang  9,2jt ZOYAMAX🥰"
rah_lkhan,11/7/2026, 14.04.06,0,"Alhamdulillah WD lagi 5jt di #ZOYAMAX 🩷🤗"
mister__alish__,11/7/2026, 14.04.05,0,"Makasih banget yang ngasih info web ZOYAMAX, gua di kasih menang 9,5jt lumayan😁"
__real___steven__16_____,11/7/2026, 14.04.05,0,"Puas banget emang main disini emg, dari kemarin gua nyoba dikasih wd teros gokil ZOYAMAX"
_its_mamta_khatik_,11/7/2026, 14.04.05,0,"Puas banget emang main disini emg, dari kemarin gua nyoba dikasih wd teros gokil ZOYAMAX"
onlyfillings12345,11/7/2026, 14.04.05,0,"Sensasinya emng beda kalau main di ZOYAMAX"
itx__rubab__4u,11/7/2026, 14.04.05,0,"Fuul senyum di kasih menang 12,4jt di ZOYAMAX 💵🔥"
mr_boy__9090_,11/7/2026, 14.04.05,0,"Alhamdulillah Masih Dikasih Menang 7,2jt di ( ZOYAMAX )"
aditya619857,11/7/2026, 14.04.04,0,"The best ZOYAMAX pilih yang paling atas di goggle. di sini, kemenangan bukan sekeder mimpi, tapi kenyataan🌠"
nanangaaziz,11/7/2026, 14.03.47,0,"Slide 3 revisi ""Didang"" > ""Sidang"" (QC netizen 😂)"
new_cka,11/7/2026, 13.42.23,0,"😂"
goyoga8,11/7/2026, 13.36.52,0,"Dissenting opinion itu selalu ada dalam setiap persidangan. Bahkan misalnya, semacam Juri Indonesian Idol aja si anang sering beda POV sendirian."
axanaffdn,11/7/2026, 13.26.12,0,"Kaburnya Jurist Tan sebelum proses peradilan buktikan ada yang salah dengan Mas Menteri dan Shadow Teamnya"
ahmadakhyar98,11/7/2026, 13.19.14,0,"DO hanya hak hakim, tidak mengubah amar putusan"
heru_gunawan7,11/7/2026, 13.08.18,0,"1 lawan 4 ,logikanya fakta dan bukti disidang saling menguatkan , klo hanya 1 hakim yg dessenting opinion itu ga bs jadi pijakan"
tomm.rony,11/7/2026, 12.28.01,0,"Kemarin kalau gak salah Tom Lembong gak dapat dissenting opinion. Kalau gak dapat dissenting opinion berarti artinya apa, min? Cc: Admin Indonesiana."
gunadiadiguna,11/7/2026, 12.05.50,0,"Disitu ada kerugian Negara"
