id,klaster_dup,fase,likes,ukuran_klaster,teks_bersih
DaR6fCMxfe-#3438,31365,f4_jul2026,36,1,"Chromebook Celeron 1ghz dualcore, harddisk 32 GB, 4 GB ram, pakai chrome management 700 RB harga 2.5 JT itu udah untung wajar. Kalau buka 6.5 JT itu udah ngawur. Ngrampok apbn, jelas google happy terus say thankyou beli saham goto, kas setara kas goto mencapaai 23T , kalau Nadim bilang ga ada duitnya iya duit nya masuk PT semua"
DaM_18rj5OO#6734,12536,f4_jul2026,0,1,Buat pak Nadiem semoga ada keajaiban ya Allahh😢
DaNC_lKSytw#6800,25745,f4_jul2026,0,1,ttp semangat Pak Nadiem
DaM_18rj5OO#15049,19388,f4_jul2026,0,1,"Info semua keluarga para hakim, wahai netizen.. tolong bantu putra bangsa yang membuka jutaan lapangan kerja ini 🔥🔥🔥"
DYSQkY4RX2K#547,5938,f3_mei2026,0,1,"Presiden nya kemana😂 kepala negara buta dan tuli soal ginian,Apa mungkin terlibat?"
DYR3czaxB9E#915,3150,f3_mei2026,0,2,Nangis banget Ya Allah😭🥺
DaM_18rj5OO#5956,11882,f4_jul2026,0,1,Kannya pakk kalo jadi pemerintahan korupsi aja soalnya yg baik bakal di jebloskan yg burukk makin baik tahtanya ya kan😭😢
DaM_18rj5OO#10961,16018,f4_jul2026,0,1,"Yang kayak gitu gak pantes dipanggil ""yang mulia"""
DaNC_lKSytw#2794,22521,f4_jul2026,0,1,"Jangan berharap pada manusia bossskuuu.... Tundukan kepalamu dalam sejadah,serahkan semuanya kepada beliau yang maha segalanya....@nadiem_makarim__"
DaR6fCMxfe-#2505,30493,f4_jul2026,0,1,Alhamdulillah.... Smg semakin banyak yg paham ...
DaM_18rj5OO#5958,11884,f4_jul2026,1,1,"hakim nya di culik aja,ikat trus kasih semut angkrang biar tau dia"
DYR3czaxB9E#3459,4580,f3_mei2026,0,1,Apa yg bisa tak bantu ya pak @nadiemmakarim 😭😭😭😭
DYR3czaxB9E#1441,3460,f3_mei2026,0,1,Ya Allah gatega banget 😢
DaR6fCMxfe-#1139,29233,f4_jul2026,0,1,Ngeriiii banget kelakuan orang pinterr
DaM_18rj5OO#1382,8042,f4_jul2026,0,1,"Itulah mengapa kalian di Indonesia bagian barat akhir-akhir ini komentar kira di Indonesia bagian timur mengapa TDK menyuarakan haknya. Saya mau kasih tau ya percuma kita ribut percuma kita berkoar-koar apakah mereka"" itu mendengar suara kita apakah aspirasi kita di terima tentu tidak JD saya mau blng kita baku tipu kita sendiri"
DaM_18rj5OO#563,7319,f4_jul2026,0,1,hakim piye kui
DaNC_lKSytw#9733,27990,f4_jul2026,0,1,Jangan bekerja untuk negara... kelak kamu masuk penjara. Contoh nyata pak Nadim. TETAP SEMANGAT PAK.!!!
DUdN5deExTD#725,1057,f2_awal2026,0,1,"Mas menteri dikorbankan, yg kuat dan sabar ya pak... Pasti menang dan pasti kebuka! Proses ini sudah di rancang buat menutupi kasus lain... Jadilah pedang pembela rakyat nantinya pak, anda bersama.orang baik"
DaM_18rj5OO#4748,10875,f4_jul2026,0,1,Astagfirullah dzolim
DaM_18rj5OO#15951,20152,f4_jul2026,0,1,Ada Allah pak Nadiem Allah alwys with us
DX8xO2EDutM#553,2501,f3_mei2026,0,2,Apa 800m 1 hari pun gak sampe dah abis.. 😂😂
DaNC_lKSytw#797,21010,f4_jul2026,0,1,Gilaaaa...MBG aman2 aja
DaM_18rj5OO#10354,15524,f4_jul2026,0,1,Wkwkkwkw hakimnya cemen banget.... Dzolim dzolim
DaM_18rj5OO#13638,18217,f4_jul2026,0,1,"Jahat bangett ini PELAKU UTAMANYA., ya Allah kalian Dzolim bangett gk takut persidangan di akhirat?Ingattt ada Allah!!"
DaM_18rj5OO#8255,13803,f4_jul2026,0,1,"Beginilah nasib menteri yang bener di Indonesia, pasti dijadikan kambing hitam sama yang gk seneng"
DYSQkY4RX2K#623,6014,f3_mei2026,0,1,Masih negara hukum?
DaM_18rj5OO#13797,18356,f4_jul2026,0,1,"Hoooo jadi ini maksudnya Prabowo menaikkan gaji hakim 300%, i see."
DaNC_lKSytw#9021,27443,f4_jul2026,1,1,sing sabar Pak ❤️
DaR6fCMxfe-#1315,29401,f4_jul2026,0,1,Yg jelasin pintar ya 🤭
DYSQkY4RX2K#451,5855,f3_mei2026,0,1,Harus bergerak ini!!
DYR3czaxB9E#4268,5045,f3_mei2026,0,1,Tuhkan bener usaha online diambil orang
DUdN5deExTD#144,489,f2_awal2026,0,1,"Yang dapet uang jadi saksi, yang ngga dapet uang malah jadi tersangka. Wah kok bisa yaa"
DaM_18rj5OO#13299,17936,f4_jul2026,1,1,Kenaikan gaji hakim gak gunaaa 😢😭🥀
DaR6fCMxfe-#1611,29674,f4_jul2026,0,1,Emang ada selain google?
DaM_18rj5OO#3099,9510,f4_jul2026,0,1,"Mas nadiem pengadilan yang mutlak adalah pengadilan dihadapan Allah SWT, tak perlu gentar, MEREKA BERDUSTA DIHADAPAN TUHAN."
DaNC_lKSytw#1414,21487,f4_jul2026,0,1,Minta tolong sama jokowi...kmu kn orgny jokowi masa dia ngk ingt kmu sih
DaNC_lKSytw#7036,25906,f4_jul2026,0,1,@jokowi @prabowo @dpr_ri @puanmaharaniri @sufmi_dasco DIEM2 AJA.... semoga selanjutnya ANDA yang akan merasakannya... AMINNNN 🔥🔥🔥
DaM_18rj5OO#4305,10515,f4_jul2026,0,3,Pancasila?
DaNC_lKSytw#8530,27067,f4_jul2026,0,1,"Semoga Tuhan YMK segera mencabut nyawa orang"" yg menzalimi Pak Nadiem. Sehat slalu Pak."
DaM_18rj5OO#515,7278,f4_jul2026,0,1,"Jangn panggil "" Yang Mulia"" lain kali panggil BABI"
DaM_18rj5OO#5432,11446,f4_jul2026,0,1,Yang kayak gitu gausah dipanggil mulia bang
DaM_18rj5OO#4966,11058,f4_jul2026,0,1,Tuhan sertai Pak @nadiemmakarim
DaM_18rj5OO#10619,15732,f4_jul2026,0,1,Jahat bgt sumpa
DYR3czaxB9E#4600,5228,f3_mei2026,0,1,"Insya Allah,,, bagaimana pun caranya,,, yang namanya kebaikan akan selalu mengalahkan kejahatan..."
DaR6fCMxfe-#3185,31122,f4_jul2026,0,1,"Korupsi orang pintar,, ternyata hakim lebih pintar,,kereennn hakim❤️🔥"
DaM_18rj5OO#12954,17657,f4_jul2026,2,1,Loohhh takut yaaa🔥🔥🔥
DaM_18rj5OO#2591,9083,f4_jul2026,0,1,Yang mulia kos bangong
DaM_18rj5OO#12814,17541,f4_jul2026,4,1,Semoga seluruh hakim nya selalu di susahkan 😂😂😂
DaR6fCMxfe-#2042,30066,f4_jul2026,0,1,"Menurut gw, betul di salah tp ada yg tdk berani diungkap hakim,otak dari proyek itu 😂.."
DaM_18rj5OO#11810,16703,f4_jul2026,0,1,Wkwk lawak bgt
DaNC_lKSytw#1444,21509,f4_jul2026,0,1,Jadi sebenermya dia itu korupsi gak wkwkwk
DaM_18rj5OO#1384,8044,f4_jul2026,0,1,Kebelet boker semua
DaM_18rj5OO#3348,9721,f4_jul2026,0,3,Laknatullah
DaNC_lKSytw#7806,26503,f4_jul2026,0,1,PK Nadiem jadi tumbal orang orang jahat ....smoga Tuhan bertindak pak ..sabar...sabar...🙏😭
DaM_18rj5OO#11664,16577,f4_jul2026,0,1,1 kata .. PARAHHHHHHHH
DYR3czaxB9E#569,2933,f3_mei2026,0,1,😢🥺😭😭😭😭😭 bersabarlah Allah pasti menolong orng yg jujur dan baik
DaM_18rj5OO#8125,13692,f4_jul2026,0,1,"Hakim yg naik 300% ini uda cair, mkny nurani, otak tinggal 0.0003%"
DaR6fCMxfe-#2886,30846,f4_jul2026,0,1,Mana setiap sidang nangis2 mulu buat drama sekeouarga lagi. Gak istrinya gak si nadim sama aja tiap sidang bikin gaduh 😂😂😂
DaM_18rj5OO#11669,16582,f4_jul2026,0,1,Indonesia kayanya kalo kiamat dapet giliran pertama deh. Dzalimnya na'udzubillah.
DaNC_lKSytw#861,21065,f4_jul2026,0,1,"Kwatir tragis kaya munir, cuma beda tempatnya di penjara. Haaeehh.. Kasian. Politik serembga tau lawan ga tau kawan. Giliran begini ga ad yg belain."
DUdN5deExTD#1174,1488,f2_awal2026,0,1,Gratifikasi itu paling gila di kalangan pejabat dan di kementrian.... Ini Guru yg mendidik sangat di tekan oleh KPK dan kejaksaan mengenai Gratifikasi....
DaM_18rj5OO#5101,11168,f4_jul2026,0,1,"Jngn panggil yg mulia pak,dia ngak pantes"
DaNC_lKSytw#6919,25825,f4_jul2026,0,1,Spill para hakim!!!
DaR6fCMxfe-#1313,29399,f4_jul2026,0,1,"Jadi maksudnya gogel ikut dalam corporasi nadim ya, terus harusnya gimana ini ikut di adili juga gitu?"
DaM_18rj5OO#7675,13316,f4_jul2026,0,1,Bakal kita tuntut di akhirat nantii para pejabat indonesia
DaM_18rj5OO#15280,19580,f4_jul2026,9,1,"Spoil nama hakimnya, istrinya, anaknya, keluarganya.. jadiin hukum sosial"
DaNC_lKSytw#3323,22946,f4_jul2026,0,1,"Cape bnget dgn pemerintahan dan hukum di negeri ini, sumpah dah muak betul🥀🥀"
DaM_18rj5OO#7615,13269,f4_jul2026,0,1,Nadiem dihukum n babu rafi jd komisaris...kiamattt
DUdN5deExTD#1703,1994,f2_awal2026,0,1,"Sebut 1 nama,jika anda ingin bebas 😂"
DaNC_lKSytw#8619,27132,f4_jul2026,0,1,Dosa jokowi luar biasa ckckck sungkem firaun
DUdN5deExTD#1716,2006,f2_awal2026,0,1,Kok dikit???
DaNC_lKSytw#1178,21309,f4_jul2026,0,1,🥀uda jd target mau ad bukti pun tetap g ad guna ny
DaNC_lKSytw#2542,22332,f4_jul2026,0,1,Tenang pak allah maha mengetahui
DaM_18rj5OO#5680,11649,f4_jul2026,0,1,"Para hakim mau cepat2 pulang, pulang ke rahmatullah soalnya udah punya rumah di neraka"
DaM_18rj5OO#1131,7821,f4_jul2026,0,1,Pa semangat ya!!🔥
DaNC_lKSytw#8892,27337,f4_jul2026,0,1,Minta tolong sama Allah mas Nadiem 😢
DaNC_lKSytw#3300,22928,f4_jul2026,0,1,Semua Jokowi di belakang ... ala komunis
DaM_18rj5OO#15924,20127,f4_jul2026,0,1,Mengerikan sekali
DaNC_lKSytw#514,20777,f4_jul2026,0,1,"Doa kami masyarakat Indonesia untuk Bpk @nadiemmakarim, percaya Tuhan akan menolong Bpk. ""Sebab orang orang yang berbuat jahat akan di lenyapkan tetapi orang orang yang menanti nantikan Tuhan akan mewarisi negri""."
DaM_18rj5OO#1918,8508,f4_jul2026,0,1,Ya Alloh 😢😢😢 semoga pak Nadim dapat keadilan dan selalu dlm lindungan Alloh swt
DaNC_lKSytw#7549,26308,f4_jul2026,0,1,Menyesal..membantu negara ini..lebih baik jaman voc..pribumi yg pintar dan membantu kenajuan lebih di hargai..penguasa ini..memang merusak kemajuan bangsa
DYR3czaxB9E#4444,5148,f3_mei2026,0,1,Semakin sakit negara ini
DYR3czaxB9E#2550,4080,f3_mei2026,0,1,"Semangat Bapak Nadiem...TUHAN TIDAK TIDUR,Sehat selalu Bapak Nadiem....orang baik"
DaNC_lKSytw#6276,25318,f4_jul2026,0,1,"Minta tolong ke tuhan pak..kalau benar, perjuangan anda akan dibantu dengan tuhan.."
DaM_18rj5OO#15805,20020,f4_jul2026,0,1,Saya doakan hakimnya nnti malam MATI atas kuasa Alloh
DaM_18rj5OO#10489,15636,f4_jul2026,0,2,"Sejak Ketentuan syarat usia wakil presiden bs dipesan, sejak itulah saya tdk percaya dgn paslon no ini.. awal saja sdh terang2an g punya malu apa lg yg mau diharapkan?"
DaM_18rj5OO#11564,16488,f4_jul2026,0,1,"Gaji mahal kelakuan mines,"
DUdN5deExTD#1348,1652,f2_awal2026,0,1,Anak buah nya yg kaya tai
DaM_18rj5OO#4653,10793,f4_jul2026,0,1,Negara ini sangat sakit😢
DaM_18rj5OO#9613,14921,f4_jul2026,1,1,memang ini negara sakit
DaNC_lKSytw#3266,22904,f4_jul2026,0,1,"Pak nadiem, mungkin di dunia ini untuk sekarang kamu pasrah dengan keadaan, dengan hukuman yang bahkan tidak pernah kamu lakukan, tapi ingat pak nadiem kita punya Allah, biar Allah aja yang membalas mereka di hari pembalasan nanti 🤲🥀"
DUdN5deExTD#623,960,f2_awal2026,0,1,"sekelas CEO itu orangnya cerdas, apalagi mulai dari bawah perusahaannya, dan biasanya ada insting tau apa yg terjadi 😄"
DaM_18rj5OO#10266,15452,f4_jul2026,0,1,Sesakit itu liat ekspresi pk nadiem😢
DaNC_lKSytw#2721,22464,f4_jul2026,2,1,Kepada Allah sebaik2 meminta pertolongan pak Menteri
DaNC_lKSytw#4783,24117,f4_jul2026,1,1,Jokowi hanya tersenyum 🤭
DaM_18rj5OO#5743,11702,f4_jul2026,0,1,"Ya Allah engkau maha adil, berikanlah keadilan untuk rakyat Indonesia"
DaM_18rj5OO#4120,10360,f4_jul2026,0,1,wowo nih perkaranya
DaNC_lKSytw#4097,23556,f4_jul2026,1,1,Bisa nggak sih bikin petisi untuk membebaskan atau paling tidak meringankan vonis pak nadiem?
DaM_18rj5OO#1171,7858,f4_jul2026,0,1,sedihhh bgttt pak🥺🫶🏻
DaNC_lKSytw#5246,24496,f4_jul2026,0,1,DI NEGARA INI MAH TIDAK ADA KEADILAN PAK NADIEM 😭😭😭🥀🥀🥀
DUdN5deExTD#632,968,f2_awal2026,0,1,BERSIHKAN SEMUA ATAU SEMAKIN HANCUR @prabowo @gibran_rakabuming 💪🇲🇨💪
DYR3czaxB9E#2945,4299,f3_mei2026,0,1,Allah yaRobb. Ntah negeri apa ini
DYmUwyLEbx9#161,6217,f3_mei2026,0,1,"Nggak baca sampe habis, cuma mau bilang klw hukum negri ini cacat dari terpidananya mas ibam yg terbukti tidak korup sama sekali, dan dalam pencarian saksi banyak saksi yg mengaku korup betulan dan tidak di pidanakan, udahlah muak/"
DaNC_lKSytw#7094,25950,f4_jul2026,0,1,Benar bisa kalah tapi benar tidak bisa salah💔
DaM_18rj5OO#10158,15361,f4_jul2026,0,1,Adakah yg bisa menolong pak nadiem ini 😭😭
DaNC_lKSytw#2266,22115,f4_jul2026,0,1,Coba minta tlg ke jokowi aja
DaNC_lKSytw#2231,22087,f4_jul2026,0,1,Tenang bpk yg tdk bersalah ingat Allah tdk tdr ya .. karma pasti ada😭😭😭
DaR6fCMxfe-#2092,30113,f4_jul2026,0,1,"Dari awal filling dan hati nurani gw,nadim bukan orang baik."
DaM_18rj5OO#6,2056,f4_jul2026,537,151,yaAllah😭
DaNC_lKSytw#9445,27757,f4_jul2026,0,1,"Satu persatu di tampakkan oleh Tuhan proses kehancuran negeri ini, mulai dari hukumnya yg bobrok, mata uang yg lemah, korupsi terang terangan tapi tak di proses, pejabat yg tak mampu bekerja silahkan di tambahkan yg lain."
DaNC_lKSytw#6138,25211,f4_jul2026,0,1,Ingat Allah pak. Serahkan sepenuhnya pada Allah
DaR6fCMxfe-#875,28981,f4_jul2026,0,1,Tapi sebenernya nadiem ini menghancurkan kurikulum pendidikan waktu masa pandemi 😢 heran banget banyak yang belain 😮
DaM_18rj5OO#4988,11075,f4_jul2026,0,1,Sakittt bgt hati
DaM_18rj5OO#1337,8002,f4_jul2026,0,1,Si Yang Mulia itu mulia dimananya?
DaM_18rj5OO#2453,8964,f4_jul2026,0,1,Malaikat tolong tangkep yang mulai nya malaikatttt
DaM_18rj5OO#12563,17324,f4_jul2026,0,1,Udah cepirit itu
DaM_18rj5OO#11150,16158,f4_jul2026,0,1,liat raut wajah pak nadiem😢
DaM_18rj5OO#5869,11805,f4_jul2026,0,1,Watahell🤣
DaM_18rj5OO#510,7274,f4_jul2026,0,1,"Kagak ada pantes nya dipanggil ""yang mulia""😂😂😂"
DaM_18rj5OO#3033,9452,f4_jul2026,0,1,man...
DaM_18rj5OO#779,7508,f4_jul2026,0,1,Katanya masya rakat mesti silaturahmi deh ke yg mulia
DaM_18rj5OO#11992,16852,f4_jul2026,0,1,"Pak hakim siap2 ya, di akhirat bakal ditagih, kenaikan gaji 300% mu gak akan bisa nolong"
DaM_18rj5OO#6336,12201,f4_jul2026,13,1,Naudzubillah min dzalik... Astaghfirullahalazim...Inna lillahi wa inna ilaihi raji'un 🥀
DaNC_lKSytw#80,20383,f4_jul2026,1,1,Orderan Mulyono
DaNC_lKSytw#1690,21703,f4_jul2026,1,1,"Mana yang janji in ke Adilan bagi masyarakat, hukum negara masih kalah oleh uang,hakim yang harus nya bisa tegakan keadilan tapi ini malah mihak ke jalan yang salah,Pancasila bukan sekedar tulisan Pancasila itu di baca di gugu dan di tiru"
DaM_18rj5OO#1666,8293,f4_jul2026,0,1,mulia apane cok
DaM_18rj5OO#14777,19171,f4_jul2026,0,1,Bikin mosi tidak percaya terhadap Pengadilan di Indonesia aja lah ....Hakim sekarang mah hakim murahan bisanya dibeli
DaNC_lKSytw#2353,22186,f4_jul2026,0,1,Parahhh pisan hukum di Indonesia ihh najisss sumpahh eweuh nu baleg ieu mah hakim sarua daih
DaM_18rj5OO#9845,15112,f4_jul2026,0,1,Sesungguhnya Allah sangat dekat.DIA akan menolongmu pak Nadiem.
DaM_18rj5OO#8164,13727,f4_jul2026,0,1,Hakim di guyur berapa M itu kira kira ?🤣
DaM_18rj5OO#7528,13195,f4_jul2026,0,1,hakimnya coba cek biasanya hakim modelan gini udah di sumpel sama duit
DaM_18rj5OO#2423,8936,f4_jul2026,0,1,Yaa Allah..ungkapkanlah seluruh dalang yg ada didalam persidangan ini...bantu bang Nadiem terbebas 😭🤲🏻 Aamiiin
DaM_18rj5OO#13325,17960,f4_jul2026,3,1,Memang kurang etika.
DaR6fCMxfe-#3210,31147,f4_jul2026,0,1,Bang jd buzzer d bayar brpa?(ucap pembenci pemerintah) 😂
DYR3czaxB9E#2639,4128,f3_mei2026,0,1,"Simalakama pak Nadiem: di mata ojol dia pahlawan, di mata pendidikan dia penjahat"
DYR3czaxB9E#4966,5414,f3_mei2026,0,1,"😭😭😭😭, Bpk org baik"
DaM_18rj5OO#1783,8395,f4_jul2026,0,1,Negara ini udah bener bener ancur
DaM_18rj5OO#5578,11565,f4_jul2026,0,1,HAKIM PINTAR TAPI BODOH. NGERI KALI YA HUKUM SUDAH BISA DI PERJUAL BELIKAN
DYR3czaxB9E#2365,3967,f3_mei2026,0,1,pertama kali jadi pejabat langsung dijadikan tumbal proyek oleh orang-orang itu
DYR3czaxB9E#2415,3996,f3_mei2026,0,1,Pada akhirnya orang baik dan pintar akan takut masuk ke dalam pemerintahan 💔
DUdN5deExTD#885,1210,f2_awal2026,0,1,Prihatin
DX8xO2EDutM#390,2351,f3_mei2026,0,1,"Bongkar tuh sumber aliran dana dan kekayaan para jaksa Indo, pada berani ga tuh 🥱🥱🥱"
DaM_18rj5OO#15203,19519,f4_jul2026,100,1,SAKIT HUKUM DI NEGARA INI !
DaM_18rj5OO#1596,8227,f4_jul2026,0,1,@prabowo @jokowi @hotmanparisofficial @pandji.pragiwaksono
DaM_18rj5OO#8142,13707,f4_jul2026,0,1,Yg mulia sangat tidak mulia
DON94SnAD_0#106,104,f1_sep2025,3,1,Mana bukti korupsinya min? 😂
DYSQkY4RX2K#377,5789,f3_mei2026,0,1,Gk bisa di tag gemoy
DaM_18rj5OO#14299,18766,f4_jul2026,0,1,"Bagaimana ini @komisiyudisialri masa Hakim tak beri kesempatan terdakwa mala kabur. Ini si sudah jelas Peradilan sesat. Tujuannya memang ingin dapatkan uang Triliunan, tanpa harus Negara Hutang. Nadiem ini hanya korban yg sengaja ditarget. Jaksa & Hakim sudah kerjasama sejak awal, buat skenarionya seperti apa. Pokoknya harus sesuai Perintah Big Bos."
DYR3czaxB9E#4008,4885,f3_mei2026,0,1,Hiduupp jokowi...hiduuuuppp jokowi teriak pria sawit dan CEO MBG🤮🤮
DaM_18rj5OO#14606,19021,f4_jul2026,0,1,Hakim bentar lagi kena karma stroke modar
DaM_18rj5OO#15131,19458,f4_jul2026,0,1,Itu ya yang katanta gaji naik 200% 😂😂😂
DaR6fCMxfe-#1382,29465,f4_jul2026,0,1,konten penggiringan opini.... gua masih bela pak nadiem.
DYR3czaxB9E#1076,3249,f3_mei2026,0,1,Org yg ciptain aplikasi membuka puluhan juta lapangan pekerjaan malah diginiin.
DYR3czaxB9E#1982,3766,f3_mei2026,0,1,Sedihnya nyampe sini bapak 💔🥺
DaM_18rj5OO#14016,18531,f4_jul2026,0,1,Tadi dengar ini di Radio mobil. Rupanya beneran begini. Sedih pak Nadiem tembus layar. 😢
DaM_18rj5OO#302,7098,f4_jul2026,0,1,Coba kalian cari tau investasi besar google ke PT AKAB
DYSQkY4RX2K#233,5657,f3_mei2026,0,1,Iblis juga insecure sama penguasa skrng
DaR6fCMxfe-#921,29026,f4_jul2026,0,1,Bentar lagi beliau jadi komisaris PT BUMN apa nih? Buzzer pak wowo
DaM_18rj5OO#30,6863,f4_jul2026,12,1,Yang bener aja 😢
DYSQkY4RX2K#66,5506,f3_mei2026,0,1,T U N T U T B A L I K JAKSA🔥🔥🔥
DaNC_lKSytw#7942,26613,f4_jul2026,0,1,Lu emg salah anjir
DYR3czaxB9E#4777,5313,f3_mei2026,3,1,Ya allah jadi ikut nanggis
DaNC_lKSytw#8531,27068,f4_jul2026,0,1,Si joko
DaM_18rj5OO#9349,14704,f4_jul2026,0,1,Negara gila gila
DaR6fCMxfe-#2402,30394,f4_jul2026,0,1,"Apapun yang terjadi di negeri ini semua dibawah Perintah Mulyono, dan dia ga bakalan pernah tersentuh HUKUM walaupun IKN juga merugikan negara 😂😂😂😂😂😂😂"
DaM_18rj5OO#7166,12904,f4_jul2026,0,1,Cieee yang gajinya 300%
DaM_18rj5OO#16117,20280,f4_jul2026,11,1,waaaaaah ga bener ini 🧐🤨
DaNC_lKSytw#9638,2580,f4_jul2026,3,53,pak🥺
DaM_18rj5OO#14271,18746,f4_jul2026,0,1,Rakyat kecil sprti kita bisa apa?
DaR6fCMxfe-#2719,30691,f4_jul2026,0,1,Mahfud aja bela nsdirm
DYSQkY4RX2K#657,6042,f3_mei2026,0,1,Padal chrome book berguna loh
DYR3czaxB9E#2071,3807,f3_mei2026,0,1,Jagat Konoha mmng sll terbalik💔💔💔
DYR3czaxB9E#2607,4115,f3_mei2026,0,1,@kejaksaan.ri cair bos
DaM_18rj5OO#2790,9249,f4_jul2026,0,1,"Hakim bayaran ini, nggak jelas"
DaNC_lKSytw#1228,21347,f4_jul2026,0,1,Minta tlg dengan sang pencipta yg tak pernah tidur mas nadim
DYR3czaxB9E#2043,3795,f3_mei2026,0,1,Tuhan pasti bekerja Pak 😭😭
DaNC_lKSytw#9497,27802,f4_jul2026,0,1,Sabar ya Pak..Allah tdk tdr..biar tangan Allah yg bekerja untuk orang2 yg Zholim
DaNC_lKSytw#6394,25417,f4_jul2026,0,1,Bubarin aja itu gojek klu emang masih milik mu pak. Biar negara kalangkabut makin banyak pengangguran
DaM_18rj5OO#14613,19027,f4_jul2026,0,1,Kejanggalan yang terlihat jelas!
DaNC_lKSytw#2825,22545,f4_jul2026,0,1,Gak bisa pak minta keadilan di Indonesia.. dzolim semua🥀🥀🥀💔😢
DaM_18rj5OO#1734,8355,f4_jul2026,1,1,ig tu hakim mana guys
DTVFd_Rk-KJ#47,158,f2_awal2026,0,1,Percayalah DPR bs memecat presiden
DaNC_lKSytw#9584,27875,f4_jul2026,0,1,Hanya pada Tuhan pak. Emang ini tdk mudah ada tangan Tuhan
DaR6fCMxfe-#1260,29349,f4_jul2026,0,1,"Ikuti sidangnya jadi anda paham, jangan dari orang yg menjelaskan di medsos ga valid dong. trus lihat hasil putusan mega koruptor lain untuk perbandingan. benar ga hakim kita."
DaM_18rj5OO#11181,16186,f4_jul2026,0,1,Nanti saya bersaksi di akhirat nantiii
DaM_18rj5OO#767,7498,f4_jul2026,0,1,Yang mutaiiiii😂
DaM_18rj5OO#4604,10752,f4_jul2026,0,1,ga sesuai sm sila ke 5 si💔
DaR6fCMxfe-#2102,30123,f4_jul2026,0,1,Mungkin
DaNC_lKSytw#7391,26182,f4_jul2026,0,1,Gak berharap terhadap sang pencipta
DaNC_lKSytw#8406,26972,f4_jul2026,0,1,Salam waras dari rakyat
DaM_18rj5OO#4325,10533,f4_jul2026,0,1,"Jangan panggil dia ""Mulia"", ga pantes!"
DaM_18rj5OO#7885,13492,f4_jul2026,0,1,apa nama ig yg MULIA itu
DYmUwyLEbx9#551,6600,f3_mei2026,0,1,Kapan indonesia siap maju kalau begini mulu
DaNC_lKSytw#8873,27320,f4_jul2026,0,1,"Maaf pak saya tidak bisa apa apa,hanya doa kl mmg benar semoga bapak dapat jalan keluar jika salah saya tidak tau salah anda apa dan harus bgmn"
DYR3czaxB9E#229,2695,f3_mei2026,0,1,Sabar terus pak serahkan pada Allah
DaNC_lKSytw#4499,23886,f4_jul2026,0,1,"Merinding saya,,sebobrok ini kah hukum di negara kita?"
DaNC_lKSytw#337,20628,f4_jul2026,0,1,Uangnya di makan jokodok. Sarjana di tipu tukang kayu. Anjai
DaM_18rj5OO#10737,15829,f4_jul2026,0,1,"@habiburokhmanjkttimur HAKIM INI APA KENA GRAFITASI PAK ?? TOLONG ATENSINYA , SIAPAPUN MUSUHNYA SEKALIPUN ITU MANTAN PRESIDEN TOLONG TEGAS"
DaM_18rj5OO#3602,9930,f4_jul2026,0,1,Cairrrrr
DaNC_lKSytw#4397,23802,f4_jul2026,0,1,Allah adalah segala galanya pak...
DaNC_lKSytw#9235,27598,f4_jul2026,0,1,Mulyono bener bener dzolim jahat banget
DYR3czaxB9E#4108,4944,f3_mei2026,0,1,😭😭😭😭😭😭😭 Ya Allah bukalah jalan utk bpk nadiem 🤲🤲🤲🤲🤲🤲🤲🤲
DYR3czaxB9E#4799,5328,f3_mei2026,0,1,@prabowo woooooo
DaM_18rj5OO#13015,17695,f4_jul2026,0,1,Tag Hakim nya ! Serang
DaM_18rj5OO#13526,18127,f4_jul2026,0,1,Gaji hakim naik 300% kerjanya pd gak bener
DaM_18rj5OO#601,7350,f4_jul2026,0,1,Semoga alloh lah memberikan hidayah kepada yang tidak jujur..
DaR6fCMxfe-#3173,31112,f4_jul2026,1,1,"Jelas ini konflik kepentingan, chromebook adalah produk google, sedangkan google adalah rekan bisnis nadim.di gojeg dari sebelum jadi mentri, dalam undang2 tipikor itu jelas cawe2 ke rekan bisnis itu haram, atau dilarang dan ini jelas ada undang2nya"" bahwa memperkaya diri sendiri atau orang atau korporasi adalah tindakan korupsi"".."
DaNC_lKSytw#7438,26218,f4_jul2026,2,1,"Kalo bapak memang benar2 tidak bersalah, insyaAllah semua akan ada jalan pak. Bismillah ikut mendoakan yang terbaik"
DYR3czaxB9E#4236,5023,f3_mei2026,0,1,Udah demoin aja 🙌🔥
DaM_18rj5OO#14250,18729,f4_jul2026,0,1,Jaman pak harto selesai itu..berakhir tragis pokoknya😂
DaR6fCMxfe-#2485,30474,f4_jul2026,0,1,"Anehnya Pertamax naik pada demooo eeeh sok2an pada mau donasi buat koruptor Nadiem 🫣 aku benci ma Nadiem, udah korupsi, ngrusak kurikulum pembodohan pelan2 🫣🫣🫣"
DYSQkY4RX2K#576,5967,f3_mei2026,0,1,Abis ini yg nongol jd dewa penolong yg ngasih abon nasi dah.. gitu ajah terus skenarionya..😂
DaM_18rj5OO#3471,9822,f4_jul2026,0,1,Bpk Presiden yang terhormat... apakah yang seperti ini akan didiamkan. Dimana letak keadilan... percum ada sidang.... Bubarin aja pengadilan.. semua udah tau banyak kecurangan di persidangan...
DaM_18rj5OO#7801,13421,f4_jul2026,0,1,Siap2 aja hakim dan orang2 yang dibaliknya menuai apa yg mereka lakukan.
DYmUwyLEbx9#509,6558,f3_mei2026,0,1,"Berarti sama kaya kopdes dong? truk dan mahindra, Sama-sama proyek pengadaan barang raksasa yang prosesnya disetir dan diintervensi oleh pihak atas/pusat."
DaM_18rj5OO#13850,18401,f4_jul2026,0,1,Selidiki hakim nya. Pasti terima suap
DaNC_lKSytw#7271,26082,f4_jul2026,3,1,Percayalah hakim hakim sudah jelas nasibnya seperti apa bila terbukti khianat...
DYSQkY4RX2K#365,5778,f3_mei2026,0,1,@daneshvivitdaneshvivit
DaM_18rj5OO#2850,9299,f4_jul2026,0,1,"Kelak ketika diyaumul akhir, hakim yang tidak adil akan dimintai pertanggung jawaban. Hukum didunia ga seberapa. Tenang aja pak Nadiem. Kelak Allah yang akan mengadilinya. Semoga Allah selalu melindungi dan senantiasa memberikan pak Nadim keadilan. Ammiin"
DaM_18rj5OO#11024,16057,f4_jul2026,0,1,"Pangilan apa Yang mulia, manusia tdk punya kemulyaan hati, Hakim2.....manusia2 biadap Allah swt melaknat mu, 🔥"
DaM_18rj5OO#1917,8507,f4_jul2026,0,1,Bang nadhim.. Waktunya berdo'a. Org yg di Dzolimi do'a nya makbul. In Syaa Allah..
DaM_18rj5OO#5492,11490,f4_jul2026,0,1,Harusnya saat ini kita ke gunung kawi santet Hakimnya
DaM_18rj5OO#8209,13763,f4_jul2026,0,1,Takut ya . 2 kata yg bikin ari2 mereka langsung bukaan 9 padahal jantan
DaM_18rj5OO#3065,9480,f4_jul2026,0,1,Sidang macam apa ini😭😭
DUdN5deExTD#303,647,f2_awal2026,0,1,"@nadiemmakarim mungkin sj sengaja ditangkap, untuk di mintai keterangan.. krn tanggung jawabnya, dia harus pastikan bagaimana proses kerja,pembelian sampai distribusi terjadi.. jika tdk ada dia dipengadilan maka semua akan bias. Kemungkinan dia akan bebas... Jika sdh ada pelakunya.. jd tdk usah bawa2 presiden dr dlu zaman mantan presiden banyak bawahannya yg korupsi, contoh: HAMBALANG, knp tdk tangkap SBY? tdk mungkin krn beliau presiden, yg perintahkan pasti utk kemajuan negara.. skrng anak buahnya yg tdk bener, mrkalah yg bertanggung jawab.. krn jika km jd pemimpin, km pastikan visi misi berjalan dgn baik.. tentunya dr Kementerian dulu yg akan menjalankan tugas dan pertanggung jawaban anggaran belanja... Krn presiden tidak pernah belanja, apa lg pegang uanh proyek.. kan lucu jg."
DaNC_lKSytw#3249,22891,f4_jul2026,0,1,@prabowo parah diem2 bae
DYR3czaxB9E#6,2533,f3_mei2026,26,1,lemess banget ya Allah 😭🥺
DYmUwyLEbx9#192,6248,f3_mei2026,0,1,Korupsi saat negara dlm keadaan darurat ( Covid 19 ) hrsnya tuntutan Hukuman Mati.
DYR3czaxB9E#3878,4807,f3_mei2026,0,1,Semoga dgn kejadian ini jadi ladang pahala dan penggugur dosa buat Pak Nadiem.
DaR6fCMxfe-#1801,29844,f4_jul2026,0,1,"Trus selama ini, instansi negri pakai windows, apa gk menguntungkan Microsoft??? Trus instansi beli HP android, apa gk nguntungin google juga?? Knapa gk sekalian diaudit yg beli produk OS Android. Trus cek email kalian, pakai google juga kan?"
DaM_18rj5OO#4852,10963,f4_jul2026,0,1,keadilan sosial bagi sirkel dan penjilat
DaNC_lKSytw#5897,25013,f4_jul2026,0,1,Pahlawan RI waktu dan tempat dipersilahkan
DaM_18rj5OO#7162,12900,f4_jul2026,0,1,Hakim g jelas
DaNC_lKSytw#2718,22462,f4_jul2026,0,1,"Dari Kejadian pak Nadim gw belajar, Jadi Warga Indonesia yg Baik dan Berbakti kepada Negara Belum Tentu di HARGAI pejabar2 Negaranya 🥀🥀🥀🥀🥀"
DaNC_lKSytw#3703,23246,f4_jul2026,0,1,Pantesan negara ini musibah trus
DaNC_lKSytw#1147,21286,f4_jul2026,0,1,"Presidennya aja diem2 aja mondar mandir luar negeri, wapresnya kemana dah? @gibran_rakabuming ?"
DaM_18rj5OO#7753,13385,f4_jul2026,0,1,Sakit💔 300% kenaikan gaji hasilnya ini?
