id,klaster_dup,fase,likes,ukuran_klaster,teks_bersih
DaM_18rj5OO#16119,20282,f4_jul2026,934,1,"Saya rasa dalam hati hakim, ""kami hanya ditugaskan untuk mendelivery vonis ini, jd tidak usah kami disuruh untuk mendegarkan pendapat dari terdakwa karena akan mendambah rasa bersalah dan berdosa kami saja"""
DaM_18rj5OO#445,7218,f4_jul2026,1,1,Yang mulia wedhus
DaM_18rj5OO#14822,19207,f4_jul2026,0,1,Hukum mcm apa di negei konoha ini? Giliran korupsi org lain hukuman ga smpe 10thn
DaM_18rj5OO#15323,19617,f4_jul2026,0,1,Jaksa sama hakim sama saja😂
DYR3czaxB9E#4292,5060,f3_mei2026,0,1,Gw driver gbk 2015. Merasa sedih
DYR3czaxB9E#2002,3775,f3_mei2026,0,1,"Hukum disini kalo banyak berarti dikriminalisasi, kalo sedikit beneran korupsi, polanya gitu aja.."
DaM_18rj5OO#2130,8692,f4_jul2026,0,1,Yaallahh gwendenggggg
DaNC_lKSytw#3451,23046,f4_jul2026,0,1,Kesalahan nadiem adalah mau di angkat jadi mentri pria solo.
DX8xO2EDutM#328,2299,f3_mei2026,0,1,"BPK yang mengaudit nadiem kudu diperiksa sih, karena janggal"
Dao9wWaDKzY#14,31384,f4_jul2026,0,2,"Thank infonya ZOYAMAX, tadi modal 50 jadi 2jt 😁🥰"
DaM_18rj5OO#12122,16963,f4_jul2026,1,1,Hakim anak ngentod dasar anjeng
DX8xO2EDutM#172,2168,f3_mei2026,0,1,"Semua atas persetujuan presiden saat itu, knp tidak diperiksa ya"
DaR6fCMxfe-#149,28308,f4_jul2026,0,1,"Masih ga ngejelasin kenapa Nadiem Makarim dipenjara, kan Nadiem Makarim dituntut karena korupsi, bukan karena ""Kerja sama"" dengan Google"
DYmUwyLEbx9#478,6528,f3_mei2026,0,1,Mendinf chromebook dripada MBG dan Koperasi
DaNC_lKSytw#8571,27100,f4_jul2026,1,1,"Pertolongan Allah nyata pak, yg sabar ya... kami semua dorong doa"
DaM_18rj5OO#11201,16206,f4_jul2026,0,1,"Hakim, Jaksa malu dan malu-malu in"
DaM_18rj5OO#11494,16442,f4_jul2026,25,1,Boleh dikatakan hanya 20% hakim di negara ini -- yang gajinya dinaikkan 300% itu -- punya nurani yang lurus... --- menurut keyakinan sayaaaaa
DaM_18rj5OO#6666,12477,f4_jul2026,0,1,Yang mulia lho ya katanyaaa💩
DaM_18rj5OO#5231,11278,f4_jul2026,0,1,thats really *******
DaM_18rj5OO#11657,16570,f4_jul2026,1,1,ga respect bgt sialan
DaM_18rj5OO#12260,17084,f4_jul2026,0,1,Hakim: wah mobil baru nih
DYR3czaxB9E#2175,3862,f3_mei2026,0,1,Didzolimi negara yang sangat dicintai nyaa 😭
DaM_18rj5OO#8731,14196,f4_jul2026,0,1,"Gw doakan yang jadi dewan hakim hidupnya ngga tenang sampe malaikat Izrail menjemput, apalagi ngga minta maaf sama pak Nadiem"
DaNC_lKSytw#2935,22636,f4_jul2026,0,1,Cukup pasukan gojek yg percaya..
DaM_18rj5OO#1963,8548,f4_jul2026,0,1,Gk beradab
DaM_18rj5OO#280,7077,f4_jul2026,0,1,RUSAK YA ALLAH RUSAK!!️
DaM_18rj5OO#3994,10257,f4_jul2026,0,1,Yg sbar BP Nadiem satu saat karma akn bicra
DaNC_lKSytw#2832,22551,f4_jul2026,0,1,Hukum indonesia udh kayak 💩
DaNC_lKSytw#1216,21340,f4_jul2026,0,1,Raffi Ahmad @raffinagita1717 mungkin bisa bantu Pak.. asisten nya aja bisa jadi Direksi Pak. RA aja bisa tuh main catur sama Presiden.
DUdN5deExTD#295,639,f2_awal2026,0,1,Nadiem orang kaya. 😂😂😂 masa iya dia ambil uang segitu doank. Harga saham peeusahan dia ajh trlyunan.... konoha konoha😂
DaM_18rj5OO#12642,17392,f4_jul2026,0,1,Celeng tenan
DaR6fCMxfe-#1462,29541,f4_jul2026,0,1,"bro, kalau pengadaan motor enaknya beli apa yah, tar kl beli motor Honda tar Honda di untungkan, kl beli Yamaha tar Yamaha diuntungkan dan nanti ketergantungan sama merk mereka 😂"
DaM_18rj5OO#6038,11952,f4_jul2026,0,1,Astaghfirullah.. Koq tega banget kayagitu
DaM_18rj5OO#12043,16896,f4_jul2026,0,1,udah kayak gini msh d percaya jadi hakim??? sakit jiwa ini negara
DaM_18rj5OO#3775,10079,f4_jul2026,0,1,Harga mahal panggung politik Indonesia
DX8xO2EDutM#25,2035,f3_mei2026,1,2,Gagal ditemukan = emang iya ada dana tapi ntar dicaerkan setelah kasus selesai dan siap dinikmati .
DYmUwyLEbx9#16,6076,f3_mei2026,21,1,"Bagaimana dengan Menteri BUMN Erick Thohir. Jika, begitu banyak petinggi BUMN terseret kasus korupsi dan penyalahgunaan wewenang, maka sdh seharusnya pemegang kendali penuh atas BUMN Erick Thohir ditangkap dan diadili, karena Erick Thohir yang selama ini memiliki peran besar dalam penunjukan dan pengawasan jajaran direksi melalui mekanisme RUPS. Tidak adil jika hanya bawahan yang diproses hukum, sementara pihak yang berada di posisi pengambil keputusan tertinggi seolah tidak tersentuh. Aparat penegak hukum harus berani mengusut secara menyeluruh dan transparan, tanpa pandang jabatan, kekuasaan, maupun kedekatan politik. Rakyat sudah terlalu sering disuguhi slogan bersih-bersih korupsi, tetapi yang terlihat justru kesan tebang pilih. Apa yg mau diharapkan dari hukum di negeri ini. Jika hukum memang masih memiliki wibawa, maka semua pihak yang diduga memiliki tanggung jawab, baik moral maupun struktural, wajib diperiksa secara terbuka berdasarkan bukti dan fakta hukum. Negara ini tidak boleh memberi kesan bahwa kekuasaan dapat menjadi tameng untuk menghindari proses hukum. Kepercayaan publik hanya bisa dipulihkan jika hukum benar-benar berlaku sama untuk semua orang 😴"
DYmUwyLEbx9#419,6470,f3_mei2026,0,1,Hati-hati nama Indonesia bisa tercoreng gara - gara kasus ini. Ada google dan chromebook di dalam kasus ini.
DYR3czaxB9E#4184,4992,f3_mei2026,0,1,Terkutuklah bagi yang mendzolimi orang yang telah menciptakan 4jt lapangan kerja 🥺🥺🥺🥺🥺
DaM_18rj5OO#5466,11474,f4_jul2026,0,1,Ini hasil 300%???
DaM_18rj5OO#14708,19111,f4_jul2026,2,1,"Betul...Hakim ketua=Wakil Tuhan . Jk tdk adil,siksaan nya sangat pedih...seluruh keluarga nya jg kena azab😡"
DaM_18rj5OO#15681,19908,f4_jul2026,0,1,B * d j i n g a n ..... k 3 p 4 r a t !!!
DaR6fCMxfe-#443,28579,f4_jul2026,0,1,Hrusnya tegas ke koruptor
DaM_18rj5OO#6527,12358,f4_jul2026,0,1,@prabowo @gibran_rakabuming @gerindra bagaimana bapak bapak?? Seperti ini kah yang layak di naaikkan gajinya??
DaM_18rj5OO#7535,13200,f4_jul2026,0,1,"Sesekali bikin kek di film2... Babi buta hakim Jaksa nya, biar paham lebih keras mana uang bayaran dengan amukan"
DUdN5deExTD#1237,1547,f2_awal2026,0,1,Ternyata terbongkar jg kasus nya
DaNC_lKSytw#2493,22298,f4_jul2026,0,1,"Coba indonesia punya ninja, bisa blusukan teror orang-orang yang menjatuhkan hukuman, wkwkwkwk"
DaNC_lKSytw#8222,26829,f4_jul2026,0,1,tobat Jokowi
DaNC_lKSytw#641,20878,f4_jul2026,0,1,🔥 pk @nadiem_makarim__
DaNC_lKSytw#6386,25409,f4_jul2026,0,1,Semoga siapa yg salah bener bakal terungkap seceppat nya hukum seluruh yg zolim sampai seluruh keturunan nya menanggung
DYmUwyLEbx9#219,6275,f3_mei2026,0,1,Ada yang meng ada ada agar jadi ada. Jauh sebelum ada seolah ada agar setelah jadi ada bisa dibawa bawa. Berteori sebelum ada. Setelah cocok ada makanan timbul. Teori cocokologi.
DaM_18rj5OO#11805,16698,f4_jul2026,1,1,Neraka is waiting for them🔥🔥
DYmUwyLEbx9#243,6299,f3_mei2026,0,1,Apakabar kuota haji yang jelas kerugian negara banyak banget kok ngga ada peradilannya?
DaM_18rj5OO#14772,19167,f4_jul2026,0,1,Si Hakim gak takut neraka ya?🤬
DaM_18rj5OO#15547,19796,f4_jul2026,0,1,😢 hancur lah negeri ini
DaM_18rj5OO#3627,9953,f4_jul2026,1,1,knp disebut yg mulia?
DaM_18rj5OO#14661,19069,f4_jul2026,0,1,Zolim bnget
DaM_18rj5OO#9143,14541,f4_jul2026,0,1,Tuhan yang maha tau
DUdN5deExTD#1632,1928,f2_awal2026,0,1,Pejabat Indonesia memang gila2
DaM_18rj5OO#5325,11357,f4_jul2026,0,1,memalukan ..astaghfirullah..bgini penegak hukum???
DaNC_lKSytw#998,21178,f4_jul2026,0,1,nyuwun tulung niku tenk senk ngekei penguripan .... Allah Azza Wajjala ....pak ND
DaM_18rj5OO#511,7275,f4_jul2026,0,1,The whole thing is just BS
DYR3czaxB9E#724,3032,f3_mei2026,0,1,Semoga bang Hotman segera bebaskan..beliau😢
DaM_18rj5OO#7030,12787,f4_jul2026,0,1,Hukum kacau di Indonesia ini🤦
DYR3czaxB9E#445,2838,f3_mei2026,0,1,😭💔💔💔 Ya Allah semoga ada jalan terbaik untuk org baik
DaM_18rj5OO#14710,19112,f4_jul2026,0,1,Kl request dh trwujud biasanya dimatiin itu pionnya. Good by hakim dan JPU deh.
DaM_18rj5OO#9160,14555,f4_jul2026,0,1,Kacau sih klo emg gak beres. Mungkin dia pikir pas mati malaikat di liang lahat cuma nontonin doang kali kim hakim ... 😂
DaM_18rj5OO#14129,18628,f4_jul2026,0,1,"Ini salah satu alasan, asing cabut investasi di indonesia"
DaNC_lKSytw#8107,26739,f4_jul2026,0,1,Nangis saya pak😭 💔
DaM_18rj5OO#734,7470,f4_jul2026,0,1,"PLIS ITU GANTILAH LAMBANG GARUDA PANCASILA YANG DIBELAKANG SAMA LAMBANG TIKUS BERDASI, SAKIT HATI ANYING LIATNYA UDAH GK PANTAS DIPASANG, UDAH JADI BAHAN OLOKAN SAMA KETIDAKADILAN. !!"
DaNC_lKSytw#2865,22581,f4_jul2026,0,1,Mungkin dengan ini Allah menaikkan derajat anda pak...🤲
DaM_18rj5OO#11118,16129,f4_jul2026,0,1,Pantas kah di panggil hakim 🤮
DUdN5deExTD#468,811,f2_awal2026,0,1,Giliran org jujur mau bangun negara malah di jebak oleh manusia serakah. Semangt pak Nadiem kebenaran akan selalu menang...🔥
DaM_18rj5OO#1004,7707,f4_jul2026,0,1,Semoga keluarga hakim ketua MATI DALAM KEADAAN PALING HINA 🥺🙏
DYR3czaxB9E#2282,3925,f3_mei2026,0,1,TNGKP JG PRIA YG 1 ITU
DaM_18rj5OO#12713,17451,f4_jul2026,0,1,Kasian liat pak Nadiem
DaR6fCMxfe-#2409,30401,f4_jul2026,0,1,The best white collar crime case even for study at Harvard Law School. It really is sophisticated
DaNC_lKSytw#7597,26347,f4_jul2026,0,1,Ojol diem aja bapaklu diginiin ?
DaNC_lKSytw#8912,27354,f4_jul2026,0,1,Banyak rakyat ber empati tapi bisa berbuat apa Pak...kalau putusan hakim hanya berdasarkan keyakinan mereka...
DYR3czaxB9E#2428,4005,f3_mei2026,0,1,Ya Allah hadirlah di diri bapak ini😭 tunjukkan keadilanmu didunia indonesia ini😭
DaM_18rj5OO#12951,17654,f4_jul2026,0,1,"@mohmahfudmd minta tolong penjelasan, apakah begitu sikap hakim..."
DYR3czaxB9E#4228,5019,f3_mei2026,0,1,Keep fighting for the truth and justice 🙏🏼
DaNC_lKSytw#2152,22022,f4_jul2026,0,1,"Banyak berdoa aja pak Nadim, biar SANG MAHA KUASA yang menunjukkan siapa yang BENAR dan SALAH lewat TULAHnya!!"
DaNC_lKSytw#2508,22307,f4_jul2026,0,1,NYESEL GAK BANG NADIEM PILIH PENGACARA? 🤔
DaNC_lKSytw#5722,24888,f4_jul2026,0,1,Ya Allah tol9ng hancurkan hakim dan semua dalang semua ini😭
DYmUwyLEbx9#63,6123,f3_mei2026,5,1,"Nadiam adlah koruptor yang belaga teraniyaya oleh keadilan, drama para koruptor yang rakus 😂"
DaM_18rj5OO#13674,18248,f4_jul2026,0,1,"KPK harus cepat turun tangan,sikap hakim sangat mencurigakan dan tdk menghormati hak-hak terdakwa"
DaM_18rj5OO#8721,14187,f4_jul2026,0,1,bangsatt
DaM_18rj5OO#13242,17888,f4_jul2026,0,1,sebenarnya yang rusak bukan negaranya tapi pemimpinya
DaM_18rj5OO#2307,8835,f4_jul2026,0,1,Miris liat hukum di Indonesia
DaNC_lKSytw#813,21024,f4_jul2026,0,1,"Semoga di azab hakim yg memutuskan pak Nadiem bersalah, struk gak lama lagi 🤲ayo rakyat Indonesia, kita amin kan biar cepat di ijabah"
DaM_18rj5OO#7711,13347,f4_jul2026,0,1,takutttt keburu dipanggil malaikat pencabut nyawa keknya🥴🥴🥴😒😔
DaNC_lKSytw#7176,26007,f4_jul2026,0,1,minta tolong @jokowi coba
DaM_18rj5OO#4057,10312,f4_jul2026,0,1,Share sampe keluar negeri bro videonya biar orang luar tau bobrok banget keadilan di indog
DaM_18rj5OO#4019,10277,f4_jul2026,0,1,"Semangatt bang nadiem Tuhan tau yg terbaik buatmu,biarlah anjing2 yg menindasmu dapat balasannya"
DaM_18rj5OO#15869,20074,f4_jul2026,0,1,"Kenapa harus di panggil yg mulia mereka manusia bukan tuhan yaa , kadang bingung jangan kita men tuhan kan manusia .. kadang bingung"
DaM_18rj5OO#521,7284,f4_jul2026,0,1,hakimnya anjeeeeeng
DUdN5deExTD#645,979,f2_awal2026,0,1,"buyarin ajalah yg namanya Legal Circle ( Kejaksaan, Mahkama Agung,,,Polisi, Pengadilan atau apalah ) wes jelas jelas ini bukti suap,,,,kok iso yah yg tertuduh malah bukan pelaku#Konoha Konoha Ancuk😡😡😡"
DaNC_lKSytw#8327,26910,f4_jul2026,0,1,Y Allah......tunjukkanlah keadilan dunia itu ada😭😭😭😭
DaNC_lKSytw#8766,27238,f4_jul2026,0,1,Semoga karma buruk bagi mereka yang zolim dinegri ini.... Ingat kalian gak selamanya hidup. Hukum tebang pilih
DaNC_lKSytw#4565,23938,f4_jul2026,0,1,Kami aj di tindas ekonomi pak
DaM_18rj5OO#10844,15916,f4_jul2026,2,1,cuma di indo hukum bs di beli
DaM_18rj5OO#2696,9172,f4_jul2026,0,1,yang apa tadi?
DaM_18rj5OO#12635,17386,f4_jul2026,1,1,"Inilah gegara ulah gaji dinaikin ye begitu,, kalian para fakir miskin, rakyat yg kasih sandang pangan kalian paham gak, jngn kabuur"
DUdN5deExTD#1210,1521,f2_awal2026,0,1,Skenario yg di rancang utk memenjarakan Ms Menteri bisa jadi Boomerang. Fakta berbalik arah. Skenarionya utk menjerat alumni Hrvard berakibat fatal bagi pembuatnya. Sudah selayaknya Pak Nadiem dibebaskan demi hukum kemanusiaan dan keadilan.
DaNC_lKSytw#7818,26514,f4_jul2026,0,1,Gusti Alloh mboten Sare Pak...
DaM_18rj5OO#3776,10080,f4_jul2026,0,1,"Inget baik"" muka si hakim, Sikat aja kalau ketemu dimanapun"
DaM_18rj5OO#10108,15318,f4_jul2026,0,1,"begitulah hakim yg tak bijak, semoga Allah SWT menggantikan hakim dan jaksa di RI ini dgn org2 bijak dgn keadilan"
DaM_18rj5OO#3206,9602,f4_jul2026,0,1,TUHAN TIDAK TIDUR.... GUSTI MBOTEN SARE... TUHAN MEMBERKATI MU DENGAN KESABARAN & KEKUATAN LAHIR BATIN... 💔💔💔
DaR6fCMxfe-#1898,29932,f4_jul2026,0,1,Kalo duit nya di bagi2 ke meja yg lain mah pasti aman.. 😅😅
DaM_18rj5OO#6674,12483,f4_jul2026,0,1,"Hakim digituin, gk berasa malu kah?😢 astagfirullah"
DYR3czaxB9E#3458,4579,f3_mei2026,0,1,"Sakit hati banget lihatnya.. Di era bapak kami semua bisa menjadi ASN dan di era bapak pula kami bisa lolos PPG dengan cepat dan mudah. Allahu Akbar. Sy yakin Gusti Allah tidak akan diam, seperti kata Bapak. Mungkin ini cara Allah akan angkat derajat Bapak jauh lebih tinggi. Bismillahirrahmanirrahim Bapak Nadiem kuat, keluarga juga tabah."
DaM_18rj5OO#3100,9511,f4_jul2026,1,1,Kita butuh the punisher
DaM_18rj5OO#11283,16274,f4_jul2026,0,2,yaAllah bapak.. 🥹
DaM_18rj5OO#1979,8561,f4_jul2026,0,1,Sumpah serapah jutaan orang pasti didengar Tuhan.
DaM_18rj5OO#5610,11594,f4_jul2026,0,1,Org2 pinter di kriminalisasi??
DaNC_lKSytw#7078,25939,f4_jul2026,0,1,jgn berbuat salah kalau g mau dihukum
DaM_18rj5OO#13620,18202,f4_jul2026,0,1,Fitnah terbesar abad ini🙌 mana terang terangan lagi
DaM_18rj5OO#6750,12549,f4_jul2026,0,1,"Ekspresi gak pernah bohong,mungkin kalau harus ditulis dengan kata kata,tak cukup 1000 halaman untuk mengungkapkan semua cerita di narasi pendek ini"
DaNC_lKSytw#1866,1948,f4_jul2026,1,15,Jokowi???
DaM_18rj5OO#7889,13495,f4_jul2026,0,1,Ga tega liatnyaa.. Aku skip2 berita Pak nadiem
DaM_18rj5OO#11715,16619,f4_jul2026,0,1,Dan yapp
DaNC_lKSytw#937,21128,f4_jul2026,0,1,Semangat.. & Bismillah..
DaM_18rj5OO#12242,17069,f4_jul2026,0,1,Konyol
DaM_18rj5OO#7848,13459,f4_jul2026,0,1,Bangsat emng tu hakim!!! Cari rumah.a...
DUdN5deExTD#619,956,f2_awal2026,0,1,Lah kan situ menterinya 😂
DUdN5deExTD#1140,1454,f2_awal2026,0,1,"Nah kan aneh dia gak dapet gratifikasi tapi malah jadi tersangka, sdgkn pejabat lain yg dapat gak jadi tersangka.."
DaM_18rj5OO#3587,9916,f4_jul2026,0,1,Laptop Vs food (M*G)...🔥
DaM_18rj5OO#15853,20060,f4_jul2026,0,1,Hancur hukum di Indonesia ini sangat memalukan dan hakim yg harus masuk penjara semoga terwujud hakim munafik
DUdN5deExTD#1164,1478,f2_awal2026,0,1,Kok gak ada nama pejabat yang lebih tinggi dan sangat tinggi?
DaM_18rj5OO#7910,1997,f4_jul2026,1,6,💔 mengerikan
DaM_18rj5OO#729,7465,f4_jul2026,0,1,"Dipanggil Yang Mulia, tap adabnya tidak Mulia"
DaNC_lKSytw#7695,26419,f4_jul2026,0,1,Koruptor hukum matl!!!
DaR6fCMxfe-#3036,30987,f4_jul2026,0,1,Setiap proyek pengadaan harus open tender. Ga boleh di kunci di satu vendor. Dari sini aja udah melanggar UU. Masa gini aja netizen ga mudeng
DaM_18rj5OO#7342,13050,f4_jul2026,0,1,"Hapus aja keadilan di negara ini, jika yang duduk dikursi pengadilan aja seperti itu"
DaM_18rj5OO#9581,14893,f4_jul2026,0,1,Aku punya keyakinan. Nadiem tidak akan di hukum 10tahun. Kebenaran akan terungkap tak lama lagi. Semangat saudaraku pejuang keadilan !!
DYR3czaxB9E#1216,3324,f3_mei2026,0,1,Siapa yang taruh bawang disini😢
DYR3czaxB9E#3941,4841,f3_mei2026,0,1,Istighfar..... Bung Nadiem... Insya Alloh.... Pihak yg menggugat/ jaksa & hakim yg memutuskan perkara... Di buka hati & fikiran nya.... Bahwa apa yg mereka tuntut & putusan.... Sangat tidak adil/ nggk Fair
DaM_18rj5OO#7344,13051,f4_jul2026,0,1,Cari tahu alamat hakimnya pakai hukum rimba bakar dan bunuh saja hakimnya krn tidak sesuai fungsinya lagi bisa di atur2 sama penguasa dibelakangnya
DYR3czaxB9E#3006,4334,f3_mei2026,0,1,Meski dulu ada beberapa kekecewaan dalam pengambilan keputusan beliau saat menjabat. Tapi ini jelas sekali tidak ada keadilan apapun yang ditegakkan dalam sidang tipikor. Semoga segara mendapat jalan terbaik pak. 😭 negara ini sudah sakit dari dalam
DaM_18rj5OO#13056,17731,f4_jul2026,0,1,Hakim yg gajinya 300%
DaM_18rj5OO#12073,16923,f4_jul2026,0,1,Serlok rumah hakim nya bang ada yg tau gak
DaNC_lKSytw#6675,25643,f4_jul2026,0,1,Ikn dan mbg merugikan negara kok gak ditangkap😂😂
DaM_18rj5OO#9991,15227,f4_jul2026,0,1,INGAT !!! PENGADILAN AKHIR MENUNGGU KALIAN 🔥🔥🔥
DaNC_lKSytw#7384,26177,f4_jul2026,0,1,@prabowo @kemensetneg.ri
DaNC_lKSytw#3624,23183,f4_jul2026,0,1,🥀 mati Hukum di KONOHA. 🥀
DaM_18rj5OO#9859,15125,f4_jul2026,0,1,"Hakim nuru sama pesanan,terkutuklah hakim yg menangani kasus ini beserta keluarganya jika keluarga nya tidak mengingatkan"
DaNC_lKSytw#3971,23455,f4_jul2026,0,1,🥀💔🥀 tolong bapak @hotmanparisofficial @prabowo
DaNC_lKSytw#7993,26655,f4_jul2026,0,1,Kirain harapan keadilan pada Jokowi 😂😂😂
DaM_18rj5OO#1860,8462,f4_jul2026,0,1,Sedih liatnya.. sekelas yang mulia 💔😭
DaNC_lKSytw#4112,23568,f4_jul2026,5,1,"Setingkat beliau saja di giniin, apalagi masyarakat biasa🥀"
DaM_18rj5OO#10188,15383,f4_jul2026,0,1,Aswww
DaR6fCMxfe-#822,28933,f4_jul2026,0,1,@hotmanparisofficial ada lawan ini bang 😂
DaM_18rj5OO#9232,14609,f4_jul2026,0,1,Si ajg harusnya ke seret @jokowi
DaM_18rj5OO#2383,8903,f4_jul2026,0,1,Semakin muak dg negara ini ya allah... 😭
DaNC_lKSytw#4514,23898,f4_jul2026,0,1,Hukum d Indonesia sudah mati
DaM_18rj5OO#11040,16068,f4_jul2026,0,1,Tahun depan gaji hakim naikan lagi 600%
DYR3czaxB9E#1802,3663,f3_mei2026,0,1,Tuhan tidak tertidur pak. Semangatttttt 🔥
DaR6fCMxfe-#338,28486,f4_jul2026,0,1,"ADA YA ORANG BELA MATI""AN KORUPTOR😂😂😂😂😂"
DaM_18rj5OO#10680,15783,f4_jul2026,1,1,Hukum diindonesia 😢
DaM_18rj5OO#14205,18693,f4_jul2026,0,1,Parah etika hakim tdk ada integritasnya. @komisiyudisialri untuk di telusuri
DaR6fCMxfe-#1341,29427,f4_jul2026,0,1,Ooooooo........!
DaM_18rj5OO#8173,13735,f4_jul2026,0,1,Lucu nya negeri ini
DaM_18rj5OO#15555,19803,f4_jul2026,0,1,"Mereka Gak usah dipanggil YANG MULIA, krn mereka gak ada bedanya sama Binatang"
DaM_18rj5OO#15575,19823,f4_jul2026,0,1,Ini rakyat gamau silaturahmi ke rumah hakimnya ni? Orang bener seperti nadiem harus kita lindungi.
DaM_18rj5OO#6897,12676,f4_jul2026,1,1,"Udah di naikin gajinya 300%, kinerja nya mah sama aja 👏"
DaR6fCMxfe-#1638,29701,f4_jul2026,0,1,"Bukan main ,, ada aja akal nya buat cari untung ,, Fir'aun juga sungkem 😂 makan uang segitu banyak sendirian , pantes kalau di hitung sampai 15thn 😂"
DaNC_lKSytw#2326,22163,f4_jul2026,0,1,"😢,masyaallah,,baru x ini saya meliahat"
DaM_18rj5OO#14544,18966,f4_jul2026,0,1,"Masih yakin, Prabowo bakal 2 periode?"
DaM_18rj5OO#12046,16899,f4_jul2026,0,1,terang terangan bgt gila
DaNC_lKSytw#5410,24629,f4_jul2026,0,1,Pak.. banyak yang mendoakammu Allah gak tidur pak😢
DUdN5deExTD#432,775,f2_awal2026,1,1,Jangan takut spek up.. jokowi luhut Setoran Uang Terbesar ke @jokowi @luhut Koruptor Rakus Serakah Perusak Bangsa Kita Indonesia #Makzulkan fufufafa gibran #Tangkap dan hukum Mati sita semua aset2 dan Uang Negara yang DiJarah mereka ini #Indonesialebihbaik
DaNC_lKSytw#23,20341,f4_jul2026,1,1,Teror rumah hakim2nya🔥
DaM_18rj5OO#5436,11449,f4_jul2026,0,1,Orang jujur kalah sama orang berjubah.
DaNC_lKSytw#8467,27022,f4_jul2026,0,1,dzolim bgt hukum negara ini 😤
DaM_18rj5OO#3457,9813,f4_jul2026,0,1,PARRRRRAAAAAH INI...
DX8xO2EDutM#307,2278,f3_mei2026,0,1,@kejaksaan.ri NEGARA GOBLOGG
DTVFd_Rk-KJ#143,245,f2_awal2026,0,1,"NGOMONG T A I K loe, kemana aja loe? 🤔🤣🤣🤣"
DYSQkY4RX2K#630,6019,f3_mei2026,0,1,ud enak jd pengusaha ingin jd Menteri Pendidikan..emg bkn bidangnya.. Penyesalan selalu datangnya Belakangan..dim
DaM_18rj5OO#15709,19933,f4_jul2026,0,1,@aniesbaswedan
DaM_18rj5OO#14373,18830,f4_jul2026,1,1,TOLONG DIBANTU BANG @hotmanparisofficial
DaM_18rj5OO#15916,20119,f4_jul2026,0,1,Criminals justice
DYmUwyLEbx9#642,6691,f3_mei2026,0,1,Tapi pada prosesnya melibatkan kejaksaan dan BPK kan? Kenapa tidak diproses saat itu juga? Bantu jawab dong
DaM_18rj5OO#3020,9439,f4_jul2026,0,1,Tuhan Menolongmu Pak Nadiem🙌
DaNC_lKSytw#3284,22917,f4_jul2026,0,1,Hakim udaah caiirr
DaM_18rj5OO#3934,10206,f4_jul2026,0,1,"Dia Hakim lho, tata tertib persidangan saja tidak di penuhi, apalagi dengan rasa keadilan yg tidak ada di buku, jelas dia tidak punya"
DYR3czaxB9E#4859,5358,f3_mei2026,0,1,pengadilan perampok
DaM_18rj5OO#1670,8297,f4_jul2026,1,1,Tidak fanthastt dipanggil yank muliahh
DaM_18rj5OO#13658,18234,f4_jul2026,0,1,"Ayo netizen ahli it spil dulu mereka, kekayaannya, hartanya, barang mewahnya biar kita tahu semua...."
DaM_18rj5OO#7154,12892,f4_jul2026,0,1,Hehhehe...berat. jd WNI...
DaNC_lKSytw#8189,26804,f4_jul2026,0,1,Dia telah jd tumbal penguasa😮
DaM_18rj5OO#13742,18311,f4_jul2026,1,1,Patut di curiga gak sih 🔥
DaNC_lKSytw#2180,22043,f4_jul2026,0,1,"Minta tolongnya hanya pada Allah SWT,Yang Maha Kuasa dan Maha Adil,Allah tidak tidur Allah Maha Mengetahui,semoga disegerakan pengadilanNya...hasbunallahwani'malwakil ni'malmaulaawani'mannasiiir....laahaulaawaakuwwata ilabillahil'aliyyil adhiiim🤲🤲🤲🤲"
DaNC_lKSytw#6950,25844,f4_jul2026,0,1,"sewa hitman aja nadiem. hakim dan keluarga dan JPU lg ada titipan itu. mesti disikat juga sama yg lbh kejam. biar pd melek, negara ini ud ga ada harapan. tinggal siapa yg jd predator dan yg dimangsa"
DUdN5deExTD#1705,1996,f2_awal2026,0,1,Daya rusaknya 1000 persen 😮😮😮😮
DaR6fCMxfe-#1189,29278,f4_jul2026,0,1,😂😂😂😂yes
DaM_18rj5OO#15234,19540,f4_jul2026,7,1,Beginikah kualitas hakim kita yg gajinya dinaikin 300% itu? #ripjustice
DaM_18rj5OO#11404,16369,f4_jul2026,0,1,Bangsat itu hakim
DaM_18rj5OO#10166,15368,f4_jul2026,0,1,se jauh ini ini yg paling aneh korupsi yg lain gada sampe 10 thn dh vonis nya lgian janggal bngt
DaNC_lKSytw#7437,26217,f4_jul2026,0,1,Tolong pak Nadiem Ya Allah🥺
DaM_18rj5OO#15263,19566,f4_jul2026,0,1,Yg katanya negri hukum tpi sang pengadil gk ngerti hukum...🤡
DaM_18rj5OO#12855,17574,f4_jul2026,3,1,"Hakim di sogok itu 😮😮😮😮,ingat hakim Tuhan akan menghajar mu"
DaM_18rj5OO#88,6915,f4_jul2026,0,1,Pak Nadiem g jujur di tanya banyak diamnya
DaM_18rj5OO#12864,17581,f4_jul2026,0,1,Itu orang2 mulyono.. dia takut nadiem ngomong seperti itu... inilah ciri2 hakim yg di gaji 300% nya pak prabowo @prabowo @gerindra
DaM_18rj5OO#4677,10813,f4_jul2026,0,1,"sekedar saran buat kaum gojek indonesia, nepalkan saja rumah hakimnya"
DYR3czaxB9E#883,3130,f3_mei2026,0,1,Kasihan bang nadim jd tambal🫣
DaM_18rj5OO#922,7633,f4_jul2026,0,1,Hakim gak ada yang adil di indo 🤣🤣🤣🤣 mending cari kita hakimi sendiri 😁
DaNC_lKSytw#3721,23260,f4_jul2026,0,1,Waduh...dulu bos nya dia kemana nih?
DaM_18rj5OO#14591,19007,f4_jul2026,0,1,Amsyooong ! Hakim juga ikutan Emang Gue pikirin
DYSQkY4RX2K#152,5582,f3_mei2026,0,1,info demo
DUdN5deExTD#1088,1406,f2_awal2026,0,1,bukankan hal biasa y dalam birokrasi kita seperti itu.. pejabat sekolah madrasah aj sudah tak malu2 tanya komisi jika deal project 😢
DYR3czaxB9E#3776,4749,f3_mei2026,0,1,"Diputar ulang yok waktunya pak, jangan sekali kali nyemplung ke pemerintahan klo ending nya kayak gini😢"
DaR6fCMxfe-#2977,30934,f4_jul2026,0,1,Bela Nadiem tapi tak bela ketua botak MBG 😂
DaM_18rj5OO#8954,14385,f4_jul2026,1,1,Putusan nya gak adil
DUdN5deExTD#1143,1457,f2_awal2026,0,1,Trus yg dpt aliran bijimana😂
DaM_18rj5OO#12080,16928,f4_jul2026,0,1,"gmn hukum bs jalan, hakim dan APH aja gk takut tuhan ☠️ Mereka hanya takut MISKIN"
DaM_18rj5OO#535,7296,f4_jul2026,0,1,Pengadilan apa yg seperti ini ......
DaM_18rj5OO#12158,16994,f4_jul2026,0,1,"Padahal sidang terbuka, jadi keliatan Hakimnya lucuuukkkkk"
DUdN5deExTD#466,809,f2_awal2026,0,1,Indonesia ku kaya.. tapi tidak warganya. Ga usah kagum liat pejabat naik mobil mewah. Doakan saja itu hasil kerja keras bukan merampok negara
DaM_18rj5OO#13717,18287,f4_jul2026,0,1,pak nadieeem🥹🥹🫂
DYR3czaxB9E#3959,4856,f3_mei2026,0,1,semangat ya pak😢 pengadilan tertinggi itu akhiratt
DaM_18rj5OO#5642,11620,f4_jul2026,0,1,Yang mulia anda itu najis yang mulia
DaM_18rj5OO#10607,15720,f4_jul2026,0,1,"Ya Alloh ya Rabb turunkan mukjizat mu,nangis rasanya melihat org yg TDK bersalah dipenjara sprt ini.😢yg kuat y pak.nadiem... sehat2selalu,yakin pasti suatu saat nanti akan ada yg membantu"
DaM_18rj5OO#2999,9421,f4_jul2026,0,1,"Ini mah bukan lagi wakil Tuhan,tapi wakil .......tambah sendiri"
DaM_18rj5OO#2874,9320,f4_jul2026,0,1,Astagfirullahal ajim..😭😭😭
DaM_18rj5OO#7039,12795,f4_jul2026,0,1,Kenapa namanya yang mulia
DaM_18rj5OO#7199,12931,f4_jul2026,0,1,Uda makan 💵 ga ngaku cuk
DaM_18rj5OO#10215,15408,f4_jul2026,0,1,Gimana ini bang Burhan hadeuuuh udh dinaikin gaji 300% juga😢
DaR6fCMxfe-#487,28621,f4_jul2026,0,1,Ga jelas loh
DaNC_lKSytw#7676,26403,f4_jul2026,0,1,Negara omon omon
DaM_18rj5OO#8888,14326,f4_jul2026,0,1,"gak tega liat expresi pak nadieum😢💔 , yang mulia sudah tidak sabar menghitung uang hasil memberi vonis"
DaNC_lKSytw#3040,22715,f4_jul2026,0,1,Minta tolong sama TUHAN lah.. orang yang you hadapi SETAN 😈 😌😌😌
DaM_18rj5OO#1615,8245,f4_jul2026,1,1,"Astagfirullah yaalloh dzolimnya yang menuduh pak nadiem ini😭😭😭💔 saya pakai gojek dan sangat memantu, terima kasih pak🙏🙏🙏"
DaM_18rj5OO#8531,14026,f4_jul2026,0,1,Pengadilan dunia yang gak pernah adil.
